{
  "$schema": "../schemas/recipe.schema.json",
  "version": "2026-06-19",
  "project_id": "test-dh03-30s",
  "title": "dh-03 女主播 30s 空跑测试片",
  "base_dir": "first390-template-locked",
  "digital_human": {
    "id": "dh-03-female-navy-gray",
    "plate_mode": "fullscreen presenter",
    "notes": "单场 presenter 满屏测试，验证第二条 recipe 可通过 registry/validator 闭环。"
  },
  "voice": {
    "mode": "character_reference",
    "voice_id": "dh03-source-clone",
    "engine": "remote_4090_cosyvoice3_direct_dh03_zero_shot",
    "reference_audio": "first390-template-locked/production/test-dh03-30s/voice/dh03-ref-24k.wav",
    "prompt_text": "first390-template-locked/production/test-dh03-30s/voice/dh03-ref.prompt.txt",
    "notes": "amy 已完成 TTS；本任务只做 recipe、装配、渲染和验收。"
  },
  "script": {
    "path": "first390-template-locked/production/test-dh03-30s/full-script-v1.txt",
    "version": "v1",
    "humanizer_status": "upstream provided final script",
    "pronunciation_notes": ["AI displays as AI"]
  },
  "audio": {
    "master": "first390-template-locked/production/test-dh03-30s/audio/master.wav",
    "timeline": "first390-template-locked/production/test-dh03-30s/audio/timeline.json",
    "captions": "first390-template-locked/production/test-dh03-30s/audio/captions-dh03.json",
    "scene_wav_dir": "first390-template-locked/production/test-dh03-30s/audio/scenes",
    "alignment": "known-text forced alignment; display text from full-script-v1, timing from provided dh03 timestamp anchor"
  },
  "visuals": {
    "width": 1280,
    "height": 720,
    "fps": 30,
    "manifest": "first390-template-locked/test-dh03-30s.manifest.json",
    "composition_html": "first390-template-locked/index-test-dh03-30s.html",
    "isolated_html": "first390-template-locked/test-dh03-30s-isolated/index.html",
    "style_notes": "Single fullscreen presenter with burned-in 36px captions."
  },
  "screen_assets": [],
  "scenes": [
    {
      "id": "s001",
      "order": 1,
      "kind": "presenter_full",
      "script_ref": "S1 单场 presenter 满屏",
      "start": 0,
      "duration": 22.4,
      "component": "HeroAroll",
      "scene_type": "aroll_emphasis",
      "duix_result": "first390-template-locked/production/test-dh03-30s/duix-results/dh03_s001-r.mp4",
      "scene_wav": "first390-template-locked/production/test-dh03-30s/audio/scenes/s001.wav",
      "frozen": true,
      "notes": "DUIX 结果已 muted，画面为 1280x720 女主播满屏。"
    }
  ],
  "outputs": {
    "silent": "first390-template-locked/render/test-dh03-30s-silent.mp4",
    "final": "first390-template-locked/render/test-dh03-30s-final.mp4"
  },
  "validation": {
    "commands": [
      "node codex-skills/video-master-pipeline/scripts/validate-recipe.mjs codex-skills/video-master-pipeline/recipes/test-dh03-30s.recipe.json",
      "cd first390-template-locked && node scripts/validate-test-dh03-30s-pipeline.mjs --final",
      "cd first390-template-locked/test-dh03-30s-isolated && npx --yes hyperframes@0.6.79 lint",
      "cd first390-template-locked/test-dh03-30s-isolated && npx --yes hyperframes@0.6.79 inspect --at 2,10,20 --timeout 120000"
    ],
    "audit_frames": [2, 10, 20],
    "notes": "Confirm dh-03 female presenter fullscreen, captions visible and not over face."
  }
}
